[
  { "id": "trait-devout", "name": "Devout", "axis": "faith", "text": "Prays before eating. Means it.", "dispositionMods": { "faithBase": 30, "vigorTrickle": 1.0, "whisperResist": -0.2 }, "keyHints": [{ "key": "shrine-access", "bloomText": "Given a shrine to their god, they work like the work is worship. It is." }], "conflictsWith": ["trait-agnostic", "trait-bitter"], "discovery": "Seen kneeling at dawn, whatever the weather." },
  { "id": "trait-observant", "name": "Observant", "axis": "faith", "text": "Keeps the rites the way you keep a habit — which is to say, mostly.", "dispositionMods": { "faithBase": 10, "vigorTrickle": 0.4 }, "keyHints": [{ "key": "rite-invitation", "bloomText": "Invited to lead one rite, they discover they meant it all along." }], "conflictsWith": ["trait-agnostic"], "discovery": "Attends rites; sits at the back." },
  { "id": "trait-agnostic", "name": "Agnostic", "axis": "faith", "text": "The sea left. That settled a few questions, in their view.", "dispositionMods": { "faithBase": -30, "vigorTrickle": 0, "whisperResist": 0.6 }, "keyHints": [{ "key": "respect-shown", "bloomText": "Never pushed to pray, they'll hold the ladder for everyone who does." }], "conflictsWith": ["trait-devout", "trait-observant"], "discovery": "Works straight through the tide-bell. Not spitefully. Just does." },
  { "id": "trait-bitter", "name": "Bitter at the Gods", "axis": "faith", "text": "Believes completely. Forgives nothing.", "dispositionMods": { "faithBase": -10, "grievanceGainMult": 1.3, "susceptibilityMult": 1.4, "whisperResist": -0.4 }, "keyHints": [{ "key": "grievance-heard", "bloomText": "Someone finally asked what the sea took from them. They talk for an hour, and something loosens." }], "conflictsWith": ["trait-devout"], "discovery": "Won't step inside the chapel; stands exactly one pace from the door during rites." },
  { "id": "trait-industrious", "name": "Industrious", "axis": "work", "text": "Finds the next task before you do.", "effects": [{ "type": "output-mult", "magnitude": 1.25, "target": "self" }], "keyHints": [{ "key": "promoted", "bloomText": "Given charge of something, they quietly reorganize it around actually working." }], "conflictsWith": ["trait-idle"], "discovery": "Their station is tidy at dusk." },
  { "id": "trait-steady", "name": "Steady", "axis": "work", "text": "Same pace in a crisis as on a quiet morning. Both are useful; one is rare.", "keyHints": [{ "key": "routine-kept", "bloomText": "A predictable schedule and they become the beam the village hangs on." }], "discovery": "You stop worrying about their station within a week." },
  { "id": "trait-idle", "name": "Idle", "axis": "work", "text": "A genius of the postponed.", "effects": [{ "type": "output-mult", "magnitude": 0.7, "target": "self" }], "keyHints": [{ "key": "right-job", "bloomText": "It was never laziness. It was the wrong work. Watch them now." }, { "key": "schedule-night", "bloomText": "Useless at noon; a marvel by moonlight. Nobody had asked." }], "conflictsWith": ["trait-industrious"], "discovery": "Three unfinished tasks, one excellent excuse." },
  { "id": "trait-burst-worker", "name": "Burst-Worker", "axis": "work", "text": "Useless on schedules; magnificent in a crisis.", "effects": [{ "type": "output-mult", "magnitude": 0.85, "target": "self" }, { "type": "crisis-output-mult", "magnitude": 2.0, "target": "self" }], "keyHints": [{ "key": "crisis-role", "bloomText": "Named the one who runs TOWARD the storm-bell, they finally have a title that fits." }], "discovery": "Watch them the night the palisade breaks." },
  { "id": "trait-storyteller", "name": "Storyteller", "axis": "social", "text": "Owns the fire after supper.", "effects": [{ "type": "village-morale", "magnitude": 1.15, "radius": 1, "target": "village" }], "keyHints": [{ "key": "audience-kept", "bloomText": "Build the fire circle and their tales get longer, and the village's nights get shorter." }], "discovery": "Count who's still at the fire an hour after the meal." },
  { "id": "trait-surly", "name": "Surly", "axis": "social", "text": "Some people are just like this. It isn't a wound and it isn't a warning.", "keyHints": [{ "key": "left-alone", "bloomText": "Never made to smile, they repay you in flawless, silent work." }], "discovery": "First conversation. Possibly the only one." },
  { "id": "trait-gossip", "name": "Gossip", "axis": "social", "text": "Knows everything a day early — and tells it a day late.", "effects": [{ "type": "doubt-spread-mult", "magnitude": 1.2, "target": "village" }, { "type": "secret-surfacing", "magnitude": 1.5, "target": "village" }], "keyHints": [{ "key": "confided-in", "bloomText": "Trusted with one real secret and kept faith, they become your best ears instead of your loudest mouth." }], "discovery": "They knew about the priest before the priest arrived." },
  { "id": "trait-night-owl", "name": "Night-Owl", "axis": "quirk", "text": "The dark doesn't wake them; the dawn does.", "keyHints": [{ "key": "schedule-night", "bloomText": "Moved to the night shift, they thrive — and the night watch stops feeling like punishment duty." }], "discovery": "Lamp oil usage. Just check the ledger." },
  { "id": "trait-dark-fearing", "name": "Fears the Dark", "axis": "quirk", "text": "Grew up on stories from the Drop. Believes every one of them, correctly.", "dispositionMods": { "grievanceGainMult": 1.2 }, "keyHints": [{ "key": "lantern-provided", "bloomText": "A lantern of their own, and the fear becomes vigilance — nobody spots trouble at dusk faster." }], "conflictsWith": ["trait-night-owl"], "discovery": "Volunteers for anything, as long as it's a day job." },
  { "id": "trait-sticky-fingers", "name": "Sticky Fingers", "axis": "quirk", "text": "Things end up in their pockets. Mostly small things. Mostly.", "dispositionMods": { "susceptibilityMult": 1.2 }, "keyHints": [{ "key": "trusted-with-stores", "bloomText": "Made quartermaster — audacity — they guard the stores like their own hoard. Which, in a way, it now is." }], "discovery": "The tally is off by one, three weeks running." },
  { "id": "trait-wanderlust", "name": "Wanderlust", "axis": "quirk", "text": "Half here. The other half is over the next rise.", "keyHints": [{ "key": "expedition-role", "bloomText": "Put on the expedition roster, they come home glowing — and they DO come home, which was the worry." }], "discovery": "Found on the palisade at dusk, looking down-slope." },
  { "id": "trait-forge-sense", "name": "Forge-Sense", "axis": "talent", "text": "Reads metal the way priests read weather.", "effects": [{ "type": "station-quality-mult", "magnitude": 1.3, "target": "self", "params": { "station": "smithing" } }], "keyHints": [{ "key": "right-job", "bloomText": "At a forge, finally, and the whole village's tools quietly improve." }], "discovery": "Watch them handle bronze salvage — they weigh it, listen to it." },
  { "id": "trait-keen-eyes", "name": "Keen Eyes", "axis": "talent", "text": "Sees the wreck on the horizon before the lookout does.", "effects": [{ "type": "expedition-find-mult", "magnitude": 1.25, "target": "self" }], "keyHints": [{ "key": "expedition-role", "bloomText": "On the salvage team, they pay for themselves the first storm." }], "discovery": "They mention the smoke a full minute before anyone else." }
]
